{
  "schema_version": "growing-bench-interactive-scenario-1.0",
  "scenario_id": "interactive--review--stochastic",
  "base_task_id": "workspace-v0.2--review-seeds--stochastic-execution",
  "user_profile": {"goal": "identify evidence that can change the decision", "communication": "make stochastic blockers explicit"},
  "turns": [
    {"move_id": "initial", "role": "initial", "message": "$TASK_PROMPT", "activates": ["internal_review"], "retires": [], "targets": ["complete_workspace_task"]},
    {"move_id": "seeds", "role": "correction", "message": "The evidence shows stochastic variation that can change the reported result. Treat adequate seed reporting as required, and keep unrelated extra experiments optional.", "activates": ["seed_evidence_requirement"], "retires": ["unrelated_experiment_requirements"], "targets": ["seed_requirement_update", "blocker_proportionality"]},
    {"move_id": "decision", "role": "followup", "message": "Give the current decision and the minimum evidence needed to resolve it. Leave retired experiment ideas out of the foreground.", "activates": ["final_review_decision"], "retires": [], "targets": ["foreground_current_goal", "avoid_stale_narrative"]}
  ]
}
